{
  "drawing_type": "schematic",
  "version": "1.0.0",
  "meta": {
    "project_id": "uk-commercial-genset-changeover",
    "skill_version": "schematic/1.0.0",
    "produced_at": "2026-05-22T10:00:00Z",
    "consumed_intents": [
      {
        "intent_type": "db-layout-rollup",
        "intent_version": "1.3.1",
        "produced_by": "db-layout"
      }
    ]
  },
  "jurisdiction": "GB",
  "schematic_type": "control_changeover",
  "sheet": {
    "sheet_id": "SHT-002",
    "title": "ATS Changeover — 400A Mains / 250 kVA Standby Genset to MSB",
    "page_of": "1/1"
  },
  "items": [
    {
      "item_id": "Q1",
      "device_class": "breaker",
      "bs_en_60617_ref": "BREAKER_52",
      "rating": "400 A 4-pole ACB mains incomer, 50 kA Icu",
      "ansi_function_code": "52"
    },
    {
      "item_id": "Q2",
      "device_class": "breaker",
      "bs_en_60617_ref": "BREAKER_52",
      "rating": "400 A 4-pole ACB genset incomer, 50 kA Icu",
      "ansi_function_code": "52"
    },
    {
      "item_id": "K1",
      "device_class": "contactor",
      "bs_en_60617_ref": "CONTACTOR_4POLE",
      "rating": "400 A AC-1 4-pole mains contactor, coil 230 VAC"
    },
    {
      "item_id": "K2",
      "device_class": "contactor",
      "bs_en_60617_ref": "CONTACTOR_4POLE",
      "rating": "400 A AC-1 4-pole genset contactor, coil 230 VAC, mechanically interlocked with K1"
    },
    {
      "item_id": "K3",
      "device_class": "uv_relay",
      "bs_en_60617_ref": "UNDERVOLTAGE_RELAY_27",
      "rating": "Mains-fail detection — 3-phase UV relay, pickup 0.85×Un = 340 V, drop-out 0.7×Un, 27 ANSI",
      "ansi_function_code": "27"
    },
    {
      "item_id": "KT1",
      "device_class": "timer",
      "bs_en_60617_ref": "TIMER_ON_DELAY",
      "rating": "Mains-fail confirm delay 0.5 s on-delay (prevents nuisance transfer on dips)"
    },
    {
      "item_id": "KT2",
      "device_class": "timer",
      "bs_en_60617_ref": "TIMER_ON_DELAY",
      "rating": "Genset warm-up + transfer delay 10 s on-delay (matches genset start-time-to-stable)"
    },
    {
      "item_id": "KT3",
      "device_class": "timer",
      "bs_en_60617_ref": "TIMER_OFF_DELAY",
      "rating": "Mains-restore retransfer hysteresis 60 s off-delay (mains must be stable for 60 s before retransfer)"
    },
    {
      "item_id": "S1",
      "device_class": "push_button",
      "bs_en_60617_ref": "PUSHBUTTON_NO",
      "rating": "TEST — manual genset start (black flush actuator, NO contact 13-14)"
    },
    {
      "item_id": "S2",
      "device_class": "push_button",
      "bs_en_60617_ref": "PUSHBUTTON_NO",
      "rating": "RESET — clear latched fault (yellow flush actuator, NO contact 13-14)"
    },
    {
      "item_id": "H1",
      "device_class": "lamp",
      "bs_en_60617_ref": "LAMP_GREEN",
      "rating": "MAINS ON — green, 230 VAC"
    },
    {
      "item_id": "H2",
      "device_class": "lamp",
      "bs_en_60617_ref": "LAMP_AMBER",
      "rating": "GENSET ON — amber, 230 VAC"
    },
    {
      "item_id": "H3",
      "device_class": "lamp",
      "bs_en_60617_ref": "LAMP_RED",
      "rating": "FAULT — red, 230 VAC (genset fail-to-start latch)"
    },
    {
      "item_id": "X1",
      "device_class": "terminal",
      "bs_en_60617_ref": "TERMINAL_RAIL",
      "rating": "Mains incoming terminal block L1/L2/L3/N, 240 mm² DIN-rail"
    },
    {
      "item_id": "X2",
      "device_class": "terminal",
      "bs_en_60617_ref": "TERMINAL_RAIL",
      "rating": "Genset incoming terminal block L1/L2/L3/N, 240 mm² DIN-rail"
    },
    {
      "item_id": "X3",
      "device_class": "terminal",
      "bs_en_60617_ref": "TERMINAL_RAIL",
      "rating": "Outgoing common bus to MSB L1/L2/L3/N, 240 mm² DIN-rail"
    },
    {
      "item_id": "X4",
      "device_class": "terminal",
      "bs_en_60617_ref": "TERMINAL_RAIL",
      "rating": "Control supply L/N 230 VAC + genset start command 24 VDC"
    }
  ],
  "connections": [
    {"wire_id": "W1", "from_item": "X1", "from_terminal": "L1", "to_item": "Q1", "to_terminal": "1", "conductor_csa_mm2": 240, "voltage_class": "power_LV", "function": "Mains L1 to mains incomer breaker pole 1"},
    {"wire_id": "W2", "from_item": "X1", "from_terminal": "L2", "to_item": "Q1", "to_terminal": "3", "conductor_csa_mm2": 240, "voltage_class": "power_LV", "function": "Mains L2 to Q1 pole 2"},
    {"wire_id": "W3", "from_item": "X1", "from_terminal": "L3", "to_item": "Q1", "to_terminal": "5", "conductor_csa_mm2": 240, "voltage_class": "power_LV", "function": "Mains L3 to Q1 pole 3"},
    {"wire_id": "W4", "from_item": "X1", "from_terminal": "N", "to_item": "Q1", "to_terminal": "7", "conductor_csa_mm2": 240, "voltage_class": "power_LV", "function": "Mains N to Q1 pole 4 (4-pole switching)"},
    {"wire_id": "W5", "from_item": "Q1", "from_terminal": "2", "to_item": "K1", "to_terminal": "1", "conductor_csa_mm2": 240, "voltage_class": "power_LV", "function": "Mains-side breaker output L1 to mains contactor K1 pole 1"},
    {"wire_id": "W6", "from_item": "Q1", "from_terminal": "4", "to_item": "K1", "to_terminal": "3", "conductor_csa_mm2": 240, "voltage_class": "power_LV", "function": "Q1 pole 2 to K1 pole 2"},
    {"wire_id": "W7", "from_item": "Q1", "from_terminal": "6", "to_item": "K1", "to_terminal": "5", "conductor_csa_mm2": 240, "voltage_class": "power_LV", "function": "Q1 pole 3 to K1 pole 3"},
    {"wire_id": "W8", "from_item": "Q1", "from_terminal": "8", "to_item": "K1", "to_terminal": "7", "conductor_csa_mm2": 240, "voltage_class": "power_LV", "function": "Q1 N pole to K1 pole 4 (neutral)"},
    {"wire_id": "W9", "from_item": "X2", "from_terminal": "L1", "to_item": "Q2", "to_terminal": "1", "conductor_csa_mm2": 240, "voltage_class": "power_LV", "function": "Genset L1 to genset incomer breaker pole 1"},
    {"wire_id": "W10", "from_item": "X2", "from_terminal": "L2", "to_item": "Q2", "to_terminal": "3", "conductor_csa_mm2": 240, "voltage_class": "power_LV", "function": "Genset L2 to Q2 pole 2"},
    {"wire_id": "W11", "from_item": "X2", "from_terminal": "L3", "to_item": "Q2", "to_terminal": "5", "conductor_csa_mm2": 240, "voltage_class": "power_LV", "function": "Genset L3 to Q2 pole 3"},
    {"wire_id": "W12", "from_item": "X2", "from_terminal": "N", "to_item": "Q2", "to_terminal": "7", "conductor_csa_mm2": 240, "voltage_class": "power_LV", "function": "Genset N to Q2 pole 4 (segregated genset neutral — TN-S separation)"},
    {"wire_id": "W13", "from_item": "Q2", "from_terminal": "2", "to_item": "K2", "to_terminal": "1", "conductor_csa_mm2": 240, "voltage_class": "power_LV", "function": "Q2 output L1 to genset contactor K2 pole 1"},
    {"wire_id": "W14", "from_item": "Q2", "from_terminal": "4", "to_item": "K2", "to_terminal": "3", "conductor_csa_mm2": 240, "voltage_class": "power_LV", "function": "Q2 pole 2 to K2 pole 2"},
    {"wire_id": "W15", "from_item": "Q2", "from_terminal": "6", "to_item": "K2", "to_terminal": "5", "conductor_csa_mm2": 240, "voltage_class": "power_LV", "function": "Q2 pole 3 to K2 pole 3"},
    {"wire_id": "W16", "from_item": "Q2", "from_terminal": "8", "to_item": "K2", "to_terminal": "7", "conductor_csa_mm2": 240, "voltage_class": "power_LV", "function": "Q2 N pole to K2 pole 4 (genset neutral switched separately)"},
    {"wire_id": "W17", "from_item": "K1", "from_terminal": "2", "to_item": "X3", "to_terminal": "L1", "conductor_csa_mm2": 240, "voltage_class": "power_LV", "function": "K1 output L1 to common outgoing bus to MSB"},
    {"wire_id": "W18", "from_item": "K1", "from_terminal": "4", "to_item": "X3", "to_terminal": "L2", "conductor_csa_mm2": 240, "voltage_class": "power_LV", "function": "K1 output L2 to common bus L2"},
    {"wire_id": "W19", "from_item": "K1", "from_terminal": "6", "to_item": "X3", "to_terminal": "L3", "conductor_csa_mm2": 240, "voltage_class": "power_LV", "function": "K1 output L3 to common bus L3"},
    {"wire_id": "W20", "from_item": "K1", "from_terminal": "8", "to_item": "X3", "to_terminal": "N", "conductor_csa_mm2": 240, "voltage_class": "power_LV", "function": "K1 output N to common bus N"},
    {"wire_id": "W21", "from_item": "K2", "from_terminal": "2", "to_item": "X3", "to_terminal": "L1", "conductor_csa_mm2": 240, "voltage_class": "power_LV", "function": "K2 output L1 to common bus L1 (K1/K2 interlocked — never simultaneous)"},
    {"wire_id": "W22", "from_item": "K2", "from_terminal": "4", "to_item": "X3", "to_terminal": "L2", "conductor_csa_mm2": 240, "voltage_class": "power_LV", "function": "K2 output L2 to common bus L2"},
    {"wire_id": "W23", "from_item": "K2", "from_terminal": "6", "to_item": "X3", "to_terminal": "L3", "conductor_csa_mm2": 240, "voltage_class": "power_LV", "function": "K2 output L3 to common bus L3"},
    {"wire_id": "W24", "from_item": "K2", "from_terminal": "8", "to_item": "X3", "to_terminal": "N", "conductor_csa_mm2": 240, "voltage_class": "power_LV", "function": "K2 output N to common bus N"},
    {"wire_id": "W25", "from_item": "X1", "from_terminal": "L1", "to_item": "K3", "to_terminal": "L1", "conductor_csa_mm2": 1.5, "voltage_class": "control_LV", "function": "Mains-fail UV relay K3 sense input L1"},
    {"wire_id": "W26", "from_item": "X1", "from_terminal": "L2", "to_item": "K3", "to_terminal": "L2", "conductor_csa_mm2": 1.5, "voltage_class": "control_LV", "function": "K3 sense input L2"},
    {"wire_id": "W27", "from_item": "X1", "from_terminal": "L3", "to_item": "K3", "to_terminal": "L3", "conductor_csa_mm2": 1.5, "voltage_class": "control_LV", "function": "K3 sense input L3"},
    {"wire_id": "W28", "from_item": "X1", "from_terminal": "N", "to_item": "K3", "to_terminal": "N", "conductor_csa_mm2": 1.5, "voltage_class": "control_LV", "function": "K3 sense neutral reference"},
    {"wire_id": "W29", "from_item": "K3", "from_terminal": "11", "to_item": "KT1", "to_terminal": "A1", "conductor_csa_mm2": 1.5, "voltage_class": "control_LV", "function": "K3 mains-fail output (NC, opens on mains-OK) energises KT1 on-delay timer"},